<?xml version="1.0" encoding="utf-8" ?>
<xs:schema xmlns:xs="http://www.w3.org/2001/XMLSchema">

  <xs:element name="Hotels">
    <xs:complexType>
      <xs:sequence>
        <xs:element name="Hotel" maxOccurs="unbounded">
          <xs:complexType>
            <xs:sequence>
              <xs:element name="Name" type="xs:string" />
              <xs:element name="Address" type="xs:string" />
              <xs:element name="Rooms" maxOccurs="unbounded">
                <xs:complexType>
                  <xs:sequence>
                    <xs:element name="RoomNumber" type="xs:int" />
                    <xs:element name="Type" type="xs:string" />
                    <xs:element name="Price" type="xs:decimal" />
                    <xs:element name="Available" type="xs:boolean" />
                  </xs:sequence>
                </xs:complexType>
              </xs:element>
            </xs:sequence>
            <xs:attribute name="HotelID" type="xs:int" use="required"/>
          </xs:complexType>
        </xs:element>
      </xs:sequence>
    </xs:complexType>
  </xs:element>

</xs:schema>
